{
  "alternatives": [
    {
      "aliasing": "none",
      "cells": 180,
      "design_id": "full-180",
      "estimand_coverage": "complete main effects and interactions",
      "reason": "infeasible sample and operational burden",
      "sample_at_32_per_cell": 5760,
      "selected": false
    },
    {
      "aliasing": "H7 and H8 contrasts partially aliased",
      "cells": 16,
      "design_id": "orthogonal-16",
      "estimand_coverage": "main effects plus selected interactions",
      "reason": "fails complete coverage of the eight frozen estimands",
      "sample_at_32_per_cell": 512,
      "selected": false
    },
    {
      "aliasing": "unregistered higher-order interactions remain aliased",
      "cells": 20,
      "design_id": "contrast-complete-20",
      "estimand_coverage": "all eight frozen contrasts plus mechanism and disclosure anchors",
      "reason": "smallest audited candidate with complete registered-estimand coverage",
      "sample_at_32_per_cell": 640,
      "selected": true
    },
    {
      "aliasing": "lower than selected design",
      "cells": 24,
      "design_id": "expanded-24",
      "estimand_coverage": "all frozen contrasts plus four robustness anchors",
      "reason": "no primary-estimand gain over the selected 20-cell design",
      "sample_at_32_per_cell": 768,
      "selected": false
    }
  ],
  "analysis_plan": {
    "cluster": "session",
    "estimand": "intent-to-treat",
    "exclusions": [
      "duplicate synthetic ID",
      "assignment outside manifest",
      "pre-treatment simulator failure"
    ],
    "heterogeneity": [
      "pre-treatment cost stratum",
      "round half"
    ],
    "manipulation_checks": [
      "source choice",
      "screen visibility",
      "reward comprehension"
    ],
    "missing_data": "retain assignment; missing outcomes remain missing; inverse-probability sensitivity only",
    "multiplicity": "Holm within each frozen family; power uses conservative Bonferroni family alpha",
    "per_protocol": "secondary among synthetically compliant records only",
    "post_treatment_controls": "none in the primary specification",
    "primary_specification": "outcome on treatment indicator and randomization-block fixed effects",
    "repeated_rounds": "participant-averaged outcomes, session-clustered inference",
    "robustness": [
      "cluster ICC sensitivity",
      "attrition sensitivity",
      "noise sensitivity",
      "per-protocol secondary"
    ],
    "stopping_rule": "fixed registered sample; no outcome-dependent stopping"
  },
  "factor_levels": {
    "acquisition": [
      "free_common",
      "costly_independent",
      "assigned_independent"
    ],
    "attention_institution": [
      "none",
      "nonbinding_ignore",
      "license"
    ],
    "attribution": [
      "absent",
      "protected"
    ],
    "disclosure": [
      "private",
      "public",
      "public_verifiable"
    ],
    "policy_recommendation": [
      "none",
      "conditional",
      "contrarian_visible"
    ],
    "public_access": [
      "none",
      "all",
      "one_random",
      "selected_audience",
      "designated"
    ],
    "public_precision": [
      "full",
      "reduced"
    ],
    "reward": [
      "equal_split",
      "universal_pooling",
      "sole_rescue",
      "marginal_coverage",
      "dd006b_joint"
    ],
    "timing": [
      "simultaneous_hidden",
      "sequential_visible"
    ]
  },
  "hypotheses": [
    {
      "assumed_effect": 0.2,
      "control_cell": "T01-costly",
      "direction": "positive",
      "estimand": "ITT risk difference",
      "hypothesis_id": "H1",
      "model": "blocked linear probability model",
      "multiplicity_family": "acquisition",
      "outcome": "independent_source_acquisition",
      "question": "Do participants under-acquire costly independent evidence?",
      "role": "primary",
      "treatment_cell": "T02-assigned"
    },
    {
      "assumed_effect": 0.12,
      "control_cell": "T00-baseline",
      "direction": "positive",
      "estimand": "ITT risk difference",
      "hypothesis_id": "H2",
      "model": "blocked linear probability model",
      "multiplicity_family": "information",
      "outcome": "truthful_report",
      "question": "Does attribution protection increase truthful disclosure?",
      "role": "primary",
      "treatment_cell": "T03-attribution"
    },
    {
      "assumed_effect": 0.1,
      "control_cell": "T00-baseline",
      "direction": "positive",
      "estimand": "ITT mean difference",
      "hypothesis_id": "H3",
      "model": "cluster-robust difference in means",
      "multiplicity_family": "allocation",
      "outcome": "distinct_informed_actions",
      "question": "Does public action visibility increase action diversity?",
      "role": "primary",
      "treatment_cell": "T06-visible"
    },
    {
      "assumed_effect": 0.14,
      "control_cell": "T15-public-pooling",
      "direction": "positive",
      "estimand": "ITT risk difference",
      "hypothesis_id": "H4",
      "model": "cluster-robust linear probability model",
      "multiplicity_family": "allocation",
      "outcome": "discovery",
      "question": "Does allocation repair outperform disclosure alone?",
      "role": "primary",
      "treatment_cell": "T19-visible-coverage"
    },
    {
      "assumed_effect": 0.15,
      "control_cell": "T07-pooling",
      "direction": "positive",
      "estimand": "ITT risk difference",
      "hypothesis_id": "H5",
      "model": "cluster-robust linear probability model",
      "multiplicity_family": "allocation",
      "outcome": "discovery",
      "question": "Does marginal-coverage reward improve discovery more than universal pooling?",
      "role": "primary",
      "treatment_cell": "T09-coverage"
    },
    {
      "assumed_effect": 0.18,
      "control_cell": "T05-verifiable",
      "direction": "positive",
      "estimand": "ITT risk difference",
      "hypothesis_id": "H6",
      "model": "blocked linear probability model",
      "multiplicity_family": "information",
      "outcome": "action_obedience",
      "question": "Does the DD-006B mechanism improve joint truth and obedience?",
      "role": "primary",
      "treatment_cell": "T16-verifiable-joint"
    },
    {
      "assumed_effect": 0.1,
      "control_cell": "T04-public",
      "direction": "positive",
      "estimand": "ITT mean difference",
      "hypothesis_id": "H7",
      "model": "blocked difference in means",
      "multiplicity_family": "information",
      "outcome": "disclosure_precision",
      "question": "Does verifiable provenance improve disclosure precision?",
      "role": "secondary",
      "treatment_cell": "T05-verifiable"
    },
    {
      "assumed_effect": 0.08,
      "control_cell": "T13-costly-coverage",
      "direction": "positive",
      "estimand": "pre-specified difference-in-differences interaction",
      "hypothesis_id": "H8",
      "model": "factorial interaction with block fixed effects",
      "multiplicity_family": "acquisition",
      "outcome": "social_net_value",
      "question": "Are acquisition assignment and allocation repair complementary?",
      "role": "secondary",
      "treatment_cell": "T14-assigned-coverage"
    },
    {
      "assumed_effect": 0.22,
      "control_cell": "T21-random-reader",
      "direction": "positive",
      "estimand": "ITT mean difference",
      "hypothesis_id": "H9",
      "model": "session-clustered difference in means",
      "multiplicity_family": "attention",
      "outcome": "public_signal_use",
      "question": "Does broadcast induce more public-signal use than one-reader access?",
      "role": "primary",
      "treatment_cell": "T20-public-all"
    },
    {
      "assumed_effect": 0.12,
      "control_cell": "T20-public-all",
      "direction": "positive",
      "estimand": "ITT risk difference",
      "hypothesis_id": "H10",
      "model": "session-clustered linear probability model",
      "multiplicity_family": "attention",
      "outcome": "discovery",
      "question": "Does single-reader access improve discovery relative to full broadcast?",
      "role": "primary",
      "treatment_cell": "T21-random-reader"
    },
    {
      "assumed_effect": 0.18,
      "control_cell": "T25-ignore-recommendation",
      "direction": "positive",
      "estimand": "ITT risk difference",
      "hypothesis_id": "H11",
      "model": "blocked linear probability model",
      "multiplicity_family": "implementation",
      "outcome": "one_reader_alignment",
      "question": "Does an attention license outperform a nonbinding ignore recommendation?",
      "role": "primary",
      "treatment_cell": "T26-attention-license"
    },
    {
      "assumed_effect": 0.24,
      "control_cell": "T20-public-all",
      "direction": "positive",
      "estimand": "ITT risk difference",
      "hypothesis_id": "H12",
      "model": "blocked linear probability model",
      "multiplicity_family": "implementation",
      "outcome": "one_reader_alignment",
      "question": "Does a designated reader implement one-reader allocation over broadcast?",
      "role": "primary",
      "treatment_cell": "T24-designated-reader"
    },
    {
      "assumed_effect": 0.08,
      "control_cell": "T20-public-all",
      "direction": "positive",
      "estimand": "ITT risk difference",
      "hypothesis_id": "H13",
      "model": "session-clustered linear probability model",
      "multiplicity_family": "attention",
      "outcome": "discovery",
      "question": "Do conditional recommendations improve discovery over broadcast?",
      "role": "secondary",
      "treatment_cell": "T27-off-signal-rescue"
    },
    {
      "assumed_effect": 0.07,
      "control_cell": "T25-ignore-recommendation",
      "direction": "positive",
      "estimand": "ITT mean difference",
      "hypothesis_id": "H14",
      "model": "session-clustered difference in means",
      "multiplicity_family": "attention",
      "outcome": "contrarian_action",